<?xml version="1.0" encoding="UTF-8"?>
<!--bài tập thực hành 2-->
<!DOCTYPE SaleDetails SYSTEM "BTTH_Lab2.dtd">
<!--<!DOCTYPE SaleDetails [
    <!ELEMENT SaleDetails (Sale+)>
    <!ELEMENT Sale (BillNumber, Date, Branch, Item, Payment)>
    <!ELEMENT BillNumber (#PCDATA)>
    <!ELEMENT Date (#PCDATA)>
    <!ELEMENT Branch (#PCDATA)>
    <!ELEMENT Item (#PCDATA)>
    <!ELEMENT Payment (#PCDATA)>
    <!ATTLIST Payment chedo (Card|Cash) #REQUIRED>
    <!ENTITY VH "Van Huesen">
    
]>-->
<SaleDetails>
    <Sale>
        <BillNumber>4568</BillNumber>
        <Date>23/02/2007</Date>
        <Branch>Hampshire</Branch>
        <Item>
            <Number>1</Number>
            <Name Category="Apparel">&VH; Jeans</Name>
            <Code>2323</Code>
            <Quantity>1</Quantity>
            <Price>200</Price>
            <Discount>10</Discount>
            <Total>180</Total>
        </Item>
        <Payment Mode="Card">
            <CardName Type="Credit">&AS;</CardName>
            <CustomerName>Allan</CustomerName>
            <CardNumber>99044993</CardNumber>
            <AccountNumber>77688906</AccountNumber>
            <GrandTotal>180</GrandTotal>
        </Payment>
    </Sale>
</SaleDetails>
